{
 "schema": "ophiolite.outcome-claim/1",
 "outcome": {
  "id": "outcome-tops-within-5m",
  "version": 1
 },
 "result": {
  "asset_id": "residuals-a",
  "revision": "2222222222222222222222222222222222222222222222222222222222222222"
 },
 "check": null,
 "delivery_id": null,
 "destination": {
  "procedure_digest": "6666666666666666666666666666666666666666666666666666666666666666",
  "label": "Team database"
 },
 "state": "refused",
 "reason": "rejected",
 "sentence": "Rejected under Tops within 5 m version 1: wb-a top 2: 5.0001 m"
}
